{
  "id": "dark",
  "name": "Dark Default",
  "type": "dark",
  "colors": {
    "surfaceBackground": "#0f172a",
    "surfacePanel": "#1e293b",
    "surfaceHeader": "#1e293b",
    "surfaceHover": "#334155",
    "surfaceActive": "#475569",
    "surfaceSelected": "#1e3a5f",
    "borderMuted": "#334155",
    "borderDefault": "#475569",
    "borderFocus": "#38bdf8",
    "textPrimary": "#f8fafc",
    "textSecondary": "#94a3b8",
    "textMuted": "#64748b",
    "textInverse": "#0f172a",
    "accentPrimary": "#38bdf8",
    "accentHover": "#0284c7",
    "accentActive": "#0369a1",
    "accentMuted": "#1e293b",
    "statusSuccess": "#22c55e",
    "statusWarning": "#f59e0b",
    "statusError": "#ef4444",
    "statusInfo": "#38bdf8",
    "gridLine": "#334155",
    "gridHeaderBg": "#1e293b",
    "gridHeaderText": "#94a3b8",
    "gridSelectionBorder": "#38bdf8",
    "gridSelectionBackground": "rgba(56, 189, 248, 0.18)"
  },
  "typography": {
    "fontFamilyUi": "-apple-system, BlinkMacSystemFont, 'Segoe UI', Roboto, Helvetica, Arial, sans-serif",
    "fontFamilyCell": "-apple-system, BlinkMacSystemFont, 'Segoe UI', Roboto, sans-serif",
    "fontFamilyMono": "ui-monospace, SFMono-Regular, Menlo, Monaco, Consolas, monospace",
    "fontSizeXs": "11px",
    "fontSizeSm": "12px",
    "fontSizeMd": "13px",
    "fontSizeLg": "15px",
    "fontSizeXl": "18px"
  },
  "borders": {
    "radiusSm": "4px",
    "radiusMd": "6px",
    "radiusLg": "10px",
    "widthDefault": "1px"
  },
  "elevation": {
    "shadowSm": "0 1px 2px rgba(0, 0, 0, 0.4)",
    "shadowMd": "0 4px 6px -1px rgba(0, 0, 0, 0.5)",
    "shadowLg": "0 10px 15px -3px rgba(0, 0, 0, 0.6)"
  }
}