{
  "id": "custom-theme",
  "name": "My Custom Theme",
  "type": "light",
  "colors": {
    "surfaceBackground": "#ffffff",
    "surfacePanel": "#ffffff",
    "surfaceHeader": "#f8fafc",
    "surfaceHover": "#f1f5f9",
    "surfaceActive": "#e2e8f0",
    "surfaceSelected": "#e0f2fe",
    "borderMuted": "#f1f5f9",
    "borderDefault": "#cbd5e1",
    "borderFocus": "#0284c7",
    "textPrimary": "#0f172a",
    "textSecondary": "#475569",
    "textMuted": "#94a3b8",
    "textInverse": "#ffffff",
    "accentPrimary": "#0284c7",
    "accentHover": "#0369a1",
    "accentActive": "#075985",
    "accentMuted": "#e0f2fe",
    "statusSuccess": "#16a34a",
    "statusWarning": "#d97706",
    "statusError": "#dc2626",
    "statusInfo": "#2563eb",
    "gridLine": "#e2e8f0",
    "gridHeaderBg": "#f8fafc",
    "gridHeaderText": "#475569",
    "gridSelectionBorder": "#0284c7",
    "gridSelectionBackground": "rgba(2, 132, 199, 0.12)"
  },
  "typography": {
    "fontFamilyUi": "-apple-system, BlinkMacSystemFont, 'Segoe UI', Roboto, sans-serif",
    "fontFamilyCell": "-apple-system, BlinkMacSystemFont, 'Segoe UI', Roboto, sans-serif",
    "fontFamilyMono": "ui-monospace, monospace"
  },
  "borders": {
    "radiusSm": "4px",
    "radiusMd": "6px",
    "radiusLg": "10px",
    "widthDefault": "1px"
  },
  "elevation": {
    "shadowSm": "0 1px 2px rgba(0,0,0,0.05)",
    "shadowMd": "0 4px 6px -1px rgba(0,0,0,0.08)",
    "shadowLg": "0 10px 15px -3px rgba(0,0,0,0.1)"
  }
}